{
  "dossier_id": "D-005",
  "step": "compliance-qa",
  "artifact": "statut_sortie.json",
  "status": "BROUILLON",
  "blocking_failures": [],
  "warnings": [
    "W001: confiance faible"
  ],
  "valuation_values": {
    "approche_comparative": 505000.0,
    "approche_cout": 505000.0,
    "approche_revenu": 505000.0
  },
  "source_fixture": "case_low_confidence.json"
}