{
  "dossier_id": "D-003",
  "step": "compliance-qa",
  "artifact": "statut_sortie.json",
  "status": "A_REVOIR",
  "blocking_failures": [
    "B005: ajustement sensible sans validation_humaine"
  ],
  "warnings": [],
  "valuation_values": {
    "approche_comparative": 500000.0,
    "approche_cout": 500000.0,
    "approche_revenu": 500000.0
  },
  "source_fixture": "case_sensitive_no_validation.json"
}