{
  "dossier_id": "D-004",
  "step": "compliance-qa",
  "artifact": "statut_sortie.json",
  "status": "A_REVOIR",
  "blocking_failures": [
    "B004: unite incoherente sujet/comparables"
  ],
  "warnings": [],
  "valuation_values": {
    "approche_comparative": 0.0,
    "approche_cout": 0.0,
    "approche_revenu": 0.0
  },
  "source_fixture": "case_unit_incoherence.json"
}